Site,Structure,Root Code,SV,Saleable,Barcode,Description,Barcode Component,SV,Description Component,Quantity,Saleable
11252,46050,103238397,1,Y ,18851932463796,วาสลีนสมูทติ้ง 290มลX2 (S) ลัง ,8851932476782,0,วาสลีน สมูทติ้ง 290 มล.X2 (S) ,6,Y 
11252,46050,103252745,1,Y ,8853801039401,กรีนไบโอนาโนเซรั่มใต้วงแขนX12 ,8853801039258,0,กรีนไบโอนาโนเซรั่มใต้วงแขน15มล ,12,Y 
11252,46060,100557082,1,N ,2001029935999,อาเซปโซสบู่80กรัม*4 ,7640129890101,0,สบู่ยาอาเซฟโซ80กรัม(MP) ,4,Y 
11252,46060,100745574,1,N ,98851989080027,WBPบีไนซ์บาธเขียว 80มล.P6 ,8851989080024,0,บีไนซ์LQS 80มล-เขียว ,6,N 
11252,46060,100773915,1,N ,78851989080115,WBPบีไนซครีมอาบน้ำแดง 200มล.P3 ,8851989080116,0,บีไนซ์ LQSขวด 170-แดง ,3,N 
11252,46060,100773919,1,N ,78851989080108,WBPบีไนซ์ครีมอาบน้ำไลท์ 180มล. ,8851989080109,0,บีไนซ์ LQSขวด 170-ขาวชมพู ,3,Y 
11252,46060,100829300,1,N ,8853502011591,BPเมอรรี่เบลล์สบู่160ก*6 ,8853502009505,0,เมอรรี่เบลล์สบู่สมุนไพร160ก(P) ,6,Y 
11252,46060,100841658,1,N ,98851989080188,WBPบีไนซ์ครีมอาบน้ำชมพู90มล.P6 ,8851989080185,0,บีไนซ์LQS 80มล-ชมพู ,6,N 
11252,46060,100960490,1,Y ,8850784894997,WBPรอร์ราสบู่สมุนไพรกลัน170GP6 ,8850784778136,0,รอร์ร่าสบู่สมุนไพรกลั่น170กรัม ,6,Y 
11252,46060,100960493,1,Y ,2001029935968,BPเบนเนทสบู่C&E130กP4 ,8850784994796,0,เบนเนทสบู่วิตามินE130G.C&E ,4,Y 
11252,46060,102171137,1,Y ,2001029935975,BPเบนเนทเอ็กตร้าไวท์130P4 ,8850784994741,0,สบู่ไวท์เทนนิ่ง เบนเนทเอ็กซ์ตร้าไวท์130 กรัม ,4,Y 
11252,46060,102395566,1,Y ,2001029935982,BPเบนเนทมะละกอ160กP4 ,8850784997742,0,เบนเนทสบู่ก้อนมะละกอ160ก ,4,Y 
11252,46060,102401163,1,Y ,18851932455715,ลักส์ LQSโรสปั้ม450มล.P2-ยกลัง ,8851932369367,0,ลักส์LQSโรส ปั้ม 450มล.P1+1 ,8,Y 
11252,46060,102401164,1,Y ,18851932455739,ลักส์ LQSขาวปั้ม450มลP2-ยกลัง ,8851932369374,0,ลักส์LQSคามิเลียปั้ม450มล.P1+1 ,8,Y 
11252,46060,102401165,1,Y ,18851932455746,ลักส์ LQSม่วงปั้ม450มลP2-ยกลัง ,8851932369381,0,ลักส์LQSม่วง ปั้ม 450มล.P1+1 ,8,Y 
11252,46060,102418356,1,Y ,18851932455722,ลักส์ LQSซากุระปั้ม450P2-ยกลัง ,8851932371346,0,ลักส์LQSซากุระ ปั้ม 450มล.P1+1 ,8,Y 
11252,46060,102600006,1,Y ,18851929018138,KALA ฮันนี่พีชบอดี้วอช1000X12 ,8851929018131,0,KA-LA ฮันนี่พีช บอดี้วอช1000มล ,12,Y 
11252,46060,102600007,1,Y ,18851929018145,KALAไวท์ซากุระบอดี้วอช1000X12 ,8851929018148,0,KA-LA ไวท์ซากุระบอดี้วอช1000มล ,12,Y 
11252,46060,102748173,1,Y ,18851929019265,กาล่าลิลลี่ชาวเวอร์615มลX12 ,8851929019268,0,กาล่าลิลลี่ ไมเซล่า ชาวเวอร์ ,12,N 
11252,46060,102748174,1,Y ,18851929019258,กาล่าพีโอนีชาวเวอร์615มลX12 ,8851929019251,0,กาล่าพีโอนี ไมเซล่าชาวเวอร์ ,12,N 
11252,46060,102867263,1,Y ,18852522224933,WBPไฮจีนิสท์โฟมล้างมือ 200มล. ,8852522224936,0,ไฮจีนิสท์ โฟมล้างมือ 200 มล ,12,Y 
11252,46060,102867264,1,Y ,18852522224940,WBPไฮจีนิสท์ โฟมล้างมือ 250มล. ,8852522224943,0,ไฮจีนิสท์ โฟมล้างมือ 250 มล ,12,Y 
11252,46060,102887426,1,Y ,18852522228054,WBPHPPฟรุ๊ตตี้ชาวเวอร์ครีม3500 ,8852522228057,0,HPPฟรุ๊ตตี้ ชาวเวอร์ครีม3500มล ,4,N 
11252,46060,102887427,1,Y ,18852522228078,WBPHPPพิงค์โรซี่ชาวเวอร์ 3500 ,8852522228071,0,HPPพิงค์โรซี่ ชาวเวอร์ 3500มล ,4,N 
11252,46060,102888006,1,Y ,18852788067275,WBPBHPสบู่เหลวล้างมือไลม์ 3700 ,8852788064130,0,BHPสบู่เหลวล้างมือไลม์ 3700มล ,4,N 
11252,46060,102888007,1,Y ,18852788067282,WBPBHPสบู่เหลวล้างมือซากุ3700 ,8852788064147,0,BHPสบู่เหลวล้างมือซากุระ3700มล ,4,N 
11252,46060,102888008,1,Y ,18852788067305,WBPไฮจีนิสท์สบู่ล้างเฟรช 390มล ,8852788064154,0,HGสบู่เหลวล้างมือเฟรช 390มล ,12,N 
11252,46060,102888009,1,Y ,18852788067299,WBPไฮจีนิสท์สบู่ล้างบีเลิฟ390 ,8852788064161,0,HGสบู่เหลวล้างมือบิเลิฟ390มล ,12,N 
11252,46060,102940092,1,Y ,18851932455753,ลักส์ LQSทับทิมปั้ม450P2-ยกลัง ,8851932440820,0,ลักส์LQSทับทิมปั้ม 450มล.P1+1 ,8,Y 
11252,46060,103010230,1,Y ,18851932455777,ลักส์ LQSมิกเบอรีปั้มP2-ยกลัง ,8851932458580,0,ลักส์LQSมิกเบอรีปั้ม450มล.P1+1 ,8,Y 
11252,46070,100651284,1,Y ,8850029202679,BPนีเวียโรลออน25มลDRYฟอร์เมนP3 ,8850029816173,0,นีเวียเมนดรายโรลออน25มล. ,3,Y 
11252,46070,100790487,1,Y ,8850029202259,นีเวียดีโอฟอร์เมนดีโอฟอร์เมนคูลคิก50 X3   ,4005808828869,0,นีเวียเมนคูลคิกโรลออน50มล. ,3,Y 
11252,46070,100836448,1,N ,78851989020913,WBPทรอสโคโลญคูลพีค 50มล.P3 ,8851989020914,0,ทรอสโคโลญ50MLคูลพีค(MP) ,3,N 
11252,46070,100892518,1,Y ,8850029204086,นีเวียไวท์เทนนิ่งเมนโรลออน50มล*3   ,4005808837489,0,นีเวียเมนไวท์โรลออน50มล. ,3,Y 
11252,46070,101037751,1,Y ,18851145600681,HP ชุดมีดโกนสำเร็จรูปแพ็ค3X72 ,8851145600684,0,HP ชุดมีดโกนสำเร็จรูปแพ็ค3 ,72,N 
11252,46070,101679184,1,Y ,4005808301904,WBPนีเวียเมนคูลโรลออน 25มลP3 ,42185437,0,นีเวียเมนคูลคิกโรลออน25มล. ,3,Y 
11252,46070,101877807,1,N ,4005808606641,นีเวีย ช แบล็ค&ไวทโรออน 50มลP3 ,4005808606634,0,นีเวียเมนโรลออนอินวิซิเบิล50มล ,3,Y 
11252,46070,101877826,1,Y ,4005808606733,WBPนีเวียเมนโรลออนอินวิ 25มลP3 ,42217459,0,นีเวียเมนโรลออนอินวิซิเบิล25มล ,3,Y 
11252,46070,102239968,1,Y ,18851145600988,BIGCชุดมีดโกน-ผู้ชายP3X36 ,8851145600981,0,BIGC ชุดมีดโกนสำหรับผู้ชาย P3 ,36,N 
11252,46070,102239970,1,Y ,18851145600995,BIGCชุดมีดโกน-ผู้หญิงP3X36 ,8851145600998,0,BIGC ชุดมีดโกนสำหรับผู้หญิง P3 ,36,N 
11252,46070,102419374,1,Y ,8850029004457,WBPนีเวียเมนคูลโรลออน 12มลP6 ,8850029004440,0,นีเวียคูลคิกโรลออน12มล ,6,Y 
11252,46070,102557341,1,N ,8850029025285,WBPนีเวียเมนดีพโรลออน 25มล.P3 ,8850029025278,0,นีเวียดีโอเมนดีพโรลออน25มล. ,3,Y 
11252,46070,102626794,1,Y ,8851932395274,WBPเคลียร์แชมพูน้ำเงิน 70มลP6 ,8851932395199,0,เคลียร์เมนแชมพูสีน้ำเงิน70มล ,6,N 
11252,46070,102713146,1,Y ,8850092502706,โฟกัสโรลออนเขียวเฟรช45 มลX6 ,8850092502560,0,โฟกัสULTโรลออน แอดเวนเจอร์40มล ,6,Y 
11252,46070,102745864,1,Y ,18851932414750,เคลียรเมนน้ำเงิน350 แพ็ค ลัง ,8851932410151,0,เคลียรเมนแชม น้ำเงิน350แพ็คคู่ ,6,Y 
11252,46070,102849199,1,Y ,18851932423271,เคลียร์แชมพูผชสีดำ350แพ็ค ลัง ,8851932422949,0,เคลียร์เมน แชม สีดำ350 แพ็คคู่ ,6,Y 
11252,46070,103111958,1,Y ,18851932458266,เคลียร์แชมพู ผช คูล 1040P6 ,8851932472852,0,เคลียร์แชมพู ผช คูล 520แพ็คคู่ ,6,Y 
11252,46120,102685962,1,Y ,8992304054402,มบล เคลียสมูท บีบี ซอง 5มล P6 ,8992304054365,0,เคลียร์สมูทออลอินวันบีบี ซอง ,6,N 
11252,46120,102932372,1,N ,8858845320638,ชีววิถีลิปบาล์มน้ำผึ้ง 2.8กP12 ,8858845320737,0,ชีววิถีลิปบาล์มน้ำผึ้ง 2.8ก ,12,N 
11252,46120,102932373,1,N ,8858845320621,ชีววิถีลิปบาลมหางจระเข้2.8กP12 ,8858845320720,0,ชีววิถีลิปบาล์มหางจระเข้2.8ก ,12,N 
11252,46120,102932374,1,N ,8858845320614,ชีววิถีลิปบาล์มมะพร้าว 2.8P12 ,8858845320713,0,ชีววิถีลิปบาล์มมะพร้าว 2.8ก ,12,Y 
11252,46120,102974719,1,Y ,8859433703222,WBP MZCฟาวเดชั่น5มล#22ไลทเบจ6P ,8859433702911,0,MZC ฟาวเดชั่น 5 มล#ไลท์เบจ ,6,N 
11252,46120,102974720,1,Y ,8859433705639,MZC ดิวอี้เมคอัพ 5 มล P6 ,8859433705622,0,MZC ดิวอี้เมคอัพ 5 มล ,6,Y 
11252,46120,102974721,1,N ,8859433705837,MZC โกลอิ้งลิป#ไทเกอร์ลิลลี่P6 ,8859433705820,0,MZC โกลอิ้งลิป#ไทเกอร์ลิลลี่ ,6,N 
11252,46120,102974722,1,N ,8859433705851,MZC โกลอิ้งลิป#พัมกิ้นP6 ,8859433705844,0,MZC โกลอิ้งลิป#พัมกิ้น ,6,N 
11252,46120,102974723,1,N ,8859433705875,MZC โกลอิ้งลิป#ออโรร่าเรดP6 ,8859433705868,0,MZC โกลอิ้งลิป#ออโรร่าเรด ,6,N 
11252,46120,102974727,1,N ,8859433722285,MZCซุปเปอร์แบล็คไลน์เนอร์P3 ,8859433722278,0,MZCซุปเปอร์แบล็คไลน์เนอร์ ,3,Y 
11252,46120,102974728,1,N ,8859433722308,MZCวอลูไมซิ่งมาสคาร่าP3 ,8859433722292,0,MZCวอลูไมซิ่งมาสคาร่า ,3,Y 
11252,46120,103033918,1,Y ,8859433716017,MZCคอลเลคติ้งซีซีครีม 5มล. พ.6 ,8859433716024,0,MZCคอลเลคติ้งซีซีครีม 5 มล ,6,Y 
11252,46120,103087579,1,Y ,8857124639942,พิณนารา โคโค่ลิปบาล์ม10กX6 ,8857124639324,0,พิณนารา โคโค่ลิปบาล์ม10ก ,6,N 
11252,46120,103117600,1,Y ,8859433766104,MZC ชิลกี้คอนซีลฯ 02 2ก. พ.6 ,8859433766074,0,MZC ชิลกี้ เบลอ คอนซีลเลอร์ 02 ,6,Y 
11252,46120,103117604,1,Y ,8859433723237,MZC แมตต์ฟาวเดชั่น SPF50 พ.6 ,8859433723220,0,MZC แมตต์ฟาวเดชั่น SPF50ไลท์ ,6,Y 
11252,46120,103185638,1,Y ,8859433791229,MZC ทูอินวันอายไพรเมอร์5มล.พ.6 ,8859433791212,0,MZC ทูอินวันอายไพรเมอร์ 5 มล. ,6,Y 
11252,46120,103191472,1,Y ,8859433797733,MZCลิปชีคแทททูทินท์ 01 2มล.พ.6 ,8859433797726,0,MZCลิปชีคแทททูทินท์ 01 2มล. ,6,Y 
11252,46120,103191473,1,Y ,8859433797757,MZCลิปชีคแทททูทินท์ 02 2มล.พ.6 ,8859433797740,0,MZCลิปชีคแทททูทินท์ 02 2มล. ,6,Y 
11252,46120,103191474,1,Y ,8859433721011,MZCชูการ์เกลซลิปโกล01 2มล. พ.6 ,8859433721004,0,MZCชูการ์เกลซด์ลิปโกลว์ 1 2มล. ,6,Y 
11252,46120,103191475,1,Y ,8859433721035,MZCชูการ์เกลซลิปโกล02 2มล. พ.6 ,8859433721028,0,MZCชูการ์เกลซด์ลิปโกลว์ 2 2มล. ,6,Y 
11252,46120,103191477,1,Y ,8859433797917,MZCสกินอัพฟาวเดชั่น02 5มล. พ.6 ,8859433797900,0,MZCสกิน อัพ ฟาวเดชั่น 02 5 มล. ,6,Y 
11252,46120,103191478,1,Y ,8859433797931,MZCสกินอัพฟาวเดชั่น03 5มล. พ.6 ,8859433797924,0,MZCสกิน อัพ ฟาวเดชั่น 03 5 มล. ,6,Y 
11252,46160,100713985,1,Y ,8850434309970,การ์นิเย่ไลท์โฟม50ML*P3 ,8991380700036,0,การ์นิเย่ไลท์คอมพลีทโฟม 50มล ,3,Y 
11252,46160,102001806,1,Y ,8850434115830,การ์นิเย่เพียวแอ็กทีฟโฟม50P3 ,8992304019388,0,การ์นิเย่ เพียวแอ็กทีฟโฟม50มล ,3,N 
11252,46160,102120524,1,Y ,4005808757756,นีเวียไวท์เพิร์ลโฟม50กP3 ,4005808757749,0,นีเวียไวท์เพิร์ลโฟม50ก ,3,Y 
11252,46160,102131791,1,Y ,8850434047346,การ์นิเย่ซากุระไวท์โฟม50มลP3 ,8992304033896,0,การ์นิเย่ซากุระ ไวท์โฟม 50มล ,3,N 
11252,46160,102664458,1,Y ,8850434175124,การ์นิเย่ไมเซล่าชมพู50มลP3 ,6923700909104,0,การ์นิเย่ไมเซล่าชมพู50มล ,3,Y 
11252,46160,102867265,1,Y ,18852522225930,WBPกาล่าไวท์เทนนิ่งโฟม100ก ,8852522225933,0,กาล่าไวท์เทนนิ่งเฟเชียลโฟม100ก ,12,N 
11252,46160,102867266,1,Y ,18852522225954,WBPกาล่าแอคเน่โฟม100ก ,8852522225957,0,กาล่าแอคเน่เฟเชียลโฟม100ก ,12,N 
11252,46160,103066114,1,Y ,8851932466400,WBPพอนด์สไบรท์โฟมชมพู50กรัม P3 ,8851932466394,0,พอนด์ส ไบรท์ โฟม ชมพู 50ก ,3,Y 
11252,46160,103066116,1,Y ,8851932466042,WBPพอนด์สไบรท์โฟมดำ 50กรัม P3 ,8851932466035,0,พอนด์ส ไบรท์ โฟม ดำ 50ก ,3,Y 
11252,46160,103066118,1,Y ,8851932466424,WBPพอนด์สไบรท์โฟมชมพู15กรัม P6 ,8851932466417,0,พอนด์ส ไบรท์ โฟม ชมพู 15ก ,6,Y 
11252,46170,101681235,1,Y ,8850434023500,การ์นิเย่ไลท์ เดย์ครีม18มลP3 ,8991380700623,0,การ์นิเย่ไลท์ เดย์ครีม18มล ,3,Y 
11252,46170,102031481,1,N ,14902430358313,โอเลย์เนเจอรัลไลท์7.5ก ลัง ,4902430358453,0,โอเลย์เนเจอรัลไวท์ไลท์7.5ก ,144,Y 
11252,46170,102031481,2,Y ,4902430358309,WBPโอเลย์เนเจอร์ฝากล่อง7.5กP6 ,4902430358453,0,โอเลย์เนเจอรัลไวท์ไลท์7.5ก ,6,Y 
11252,46170,102219603,1,Y ,8850434071686,การ์นิเย่ซากุระสลีปปิ้ง18มลP3 ,8992304046957,0,การ์นิเย่ ซากุระไวท์ไนท์ 18มล. ,3,N 
11252,46170,102242076,1,N ,14902430408094,โอเลย์เนเจอรัลพิงค์7.5ก ลัง ,4902430408097,0,โอเลย์เนเจอรัลไวท์พิงค์คิช7.5ก ,144,Y 
11252,46170,102242076,2,Y ,4902430408417,WBPโอเลย์เนเจอรัลพิงค์7.5กP6 ,4902430408097,0,โอเลย์เนเจอรัลไวท์พิงค์คิช7.5ก ,6,Y 
11252,46170,102242077,1,N ,14902430999165,โอเลย์โททัลไวท์8ก ลัง ,4902430142571,0,โอเลย์โททัลไวท์สปอตครีม 8 กรัม ,144,Y 
11252,46170,102242077,2,Y ,4902430999168,WBPโอเลสปอทไลเทนนิงครีม10กP6 ,4902430142571,0,โอเลย์โททัลไวท์สปอตครีม 8 กรัม ,6,Y 
11252,46170,102505241,1,Y ,8850434140337,การ์นิเย่เซรั่มมาส์ก ซากุระ 10 ,6970175253652,0,กานิเย่ เซรั่มมาส์ก ซากุระไวท์ ,10,Y 
11252,46170,102545563,1,Y ,8850434140344,การ์นิเย่มาส์กไลท์คอมพลีท P10 ,6970175253959,0,กานิเย่เซรัมมาส์กไลคอมพลีท32ก ,10,Y 
11252,46170,102552918,1,N ,8851932382991,WBPพอนด์สบิวตี้ฝาหมุนชมพู7กP6 ,8851932382977,0,พอนด์สไวท์บิวตี้ ฝาหมุนชมพู 7ก ,6,N 
11252,46170,102552927,1,Y ,8859082301312,P_สเนลไวท์โกลด์SPF30  7มล*6 ,8859082301305,0,P_สเนลไวท์โกลด์ครีมSPF30  7มล ,6,N 
11252,46170,102586924,1,Y ,8850434140320,การ์นิเย่ไฮดร้าบอมรีพลัมปิ้ง10 ,6970175253645,0,กานิเยมาส์กไฮดร้ารีพลัมปิ้ง32ก ,10,Y 
11252,46170,102649816,1,Y ,6923700927900,การ์นิเย่ ไฮดร้าบอมอาย มาส์ก10 ,6923700927863,0,การ์นิเยอายมาส์กไบร์ท6ก ,10,Y 
11252,46170,102664461,2,N ,4902430829472,WBPโอเลย์เนเชอรัลไวท์เอจ7.5P6 ,4902430829465,0,โอเลย์เนเชอรัลไวท์เอจเลส7.5ก ,6,N 
11252,46170,102664461,1,N ,14902430829462,OLAY NATURAL AGELESS7.5GCASE ,4902430829465,0,โอเลย์เนเชอรัลไวท์เอจเลส7.5ก ,144,N 
11252,46170,102677437,1,Y ,8859477700096,WBPคิซ่ารังนกทองคำมาส์ก 35กP12 ,8859477700089,0,คิซ่ารังนกทองคำมาส์ก35ก ,12,N 
11252,46170,102677438,1,Y ,8859477700119,WBPคิซ่าแพลงสาหร่ายมาส์ก35กP12 ,8859477700102,0,คิซ่าแพลงก์ตอนสาหร่ายมาส์ก35ก ,12,N 
11252,46170,102677441,1,Y ,8858882901340,WBPจุฬาเฮิร์บดีดีวอเตอเมลอนP6 ,8858882901333,0,จุฬาเฮิร์บ ดีดีวอเตอเมลอน 8ก ,6,Y 
11252,46170,102678382,1,Y ,8994993021536,WBPลอรีอัลรีไวทัลลิฟเดย์ 7มลP6 ,8994993020911,0,ลอรีอัลรีไวทัลลิฟเดย์7มล ,6,Y 
11252,46170,102678383,1,N ,8994993021543,WBPลอรีอัลรีไวทัลลิฟไนท์ 7มลP6 ,8994993020928,0,ลอรีอัลรีไวทัลลิฟไนท์7มล ,6,N 
11252,46170,102685927,1,Y ,8857100131439,WBPอัญญานางคำทานาคา21ก1P2 ,8857100131408,0,อัญญานางมาส์กวานนางคำทานาคา21ก ,12,N 
11252,46170,102685928,1,Y ,8857100131422,WBPอัญญาบีบีครีม 10กรัม P12 ,8857100131392,0,อัญญานางบีบีทานาคาและทองคำ10ก ,12,N 
11252,46170,102685929,1,Y ,8857100131606,WBPเฟซี่เซอรามายมาส์ก10กP12 ,8857100131590,0,เฟซี่เซอรามายด์ทิชชู่มาส์ก10ก ,12,N 
11252,46170,102685930,1,Y ,8857100131620,WBPเฟซี่ไวททิชชูว์มาส์ก10กP12 ,8857100131613,0,เฟซี่ออลไวท์ทืชชู่ว์มาส์ก10ก ,12,N 
11252,46170,102685931,1,N ,8857100131415,WBPอัญญานางสครับมะขามบก10กP12 ,8857100131385,0,อัญญานางสครับมะขามใบบัวบก10ก ,12,Y 
11252,46170,102685932,1,Y ,8857100131538,WBPอัญญานางครีมมะขาม10กP12 ,8857100131521,0,อัญญานางครีมมะขามเพชรบูรณ์10ก ,12,N 
11252,46170,102685933,1,N ,8858842039069,WBPพอมเมอแกรนเนทมาส์กชีท20มล ,8809127534670,0,พอมเมอแกรนมาส์กชีท 20มล ,6,Y 
11252,46170,102685934,1,Y ,8858842039076,WBPคูคัมเบอร์มาส์กชีท20มล ,8809127534717,0,BBคูคัมเบอร์มาส์กชีท20มล ,6,Y 
11252,46170,102685935,1,N ,8858718638921,WBPนามิวิตามินซีไบรท์เจล30กP6 ,8858718638914,0,นามิแอมเฟรชเชจูวิตซีไบรทเจลซอง ,6,N 
11252,46170,102685936,1,Y ,8858718638983,WBPนามิแอมเฟรชแทมมารีนไวท์ 30ก ,8858718638976,0,นามิแอมเฟรชแทมมารีนไวทสครับซอง ,6,Y 
11252,46170,102685943,1,Y ,8809433726202,EXCแคนดี้ลิทเทิลวิทมาก20มล*10 ,8809433726134,0,EXCแคนดี้ ลิทเทิลวิทมาส์ก20มล. ,10,N 
11252,46170,102685944,1,Y ,8809433726196,EXCแคนดี้ฮันนี่มิลมาก20มล*10 ,8809433726035,0,EXCแคนดี้ ฮันนี่มิลมาส์ก20มล. ,10,N 
11252,46170,102685945,1,Y ,8809433726158,EXCแคนดี้เมโลคอตตอนมาก20มล*10 ,8809433726103,0,EXCแคนดี้ เมโลคอตตอนมาส์ก20มล. ,10,N 
11252,46170,102685946,1,Y ,8809220801211,นีลมอยส์มาร์คสูตรนม22ก*6 ,8809220800948,0,นีลมอยส์มาร์คสูตรนม22ก ,6,N 
11252,46170,102685947,1,Y ,8809220801198,นีลมอยส์มาร์คไฮยาลูรอนนิค22ก*6 ,8809220800924,0,นีลมอยส์มาคสูตรไฮยาลูรอนนิค22ก ,6,N 
11252,46170,102685948,1,Y ,8809220801297,นีลอาฟเตอซันมาร์คอโลเวร่า22ก*6 ,8809220800962,0,นีลอาฟเตอร์ซันมาร์คอโลเวร่า22ก ,6,Y 
11252,46170,102685949,1,Y ,8809220801204,นีลไบรทเทนนิ่งมาร์คไข่มุก22ก*6 ,8809220800931,0,นีลไบรท์เทนนิ่งมาร์คไข่มุก22ก ,6,N 
11252,46170,102685950,1,Y ,8809220800986,นีลเฟิร์มมิ่งมาร์คคิวเท็น22ก*6 ,8809220800917,0,นีลเฟิร์มมิ่งมาร์คคิวเท็น22ก ,6,N 
11252,46170,102685951,1,N ,8851932389594,WBPพอนด์สไวท์บิวตี้โทนอัพ7กP6 ,8851932389570,0,พอนด์สไวท์บิวตี้โทนอัพครีม7ก ,6,N 
11252,46170,102685952,1,N ,8851932377461,WBPพอนด์สเอจเดย์ครีมบี 7กP6 ,8851932377454,0,พอนด์สเอจเดย์ครีม7ก ,6,N 
11252,46170,102685953,1,Y ,8994993003174,WBPการ์นิเย่ เอจเลสไนท์7มลP6 ,8850434160281,0,การ์นิเย่ เอจเลสไนท์ครีมซอง7มล ,6,Y 
11252,46170,102685954,1,Y ,8850434047285,WBPการ์นิเย่ซากุระพิงคิช 7มลP6 ,8992304033919,0,การ์นิเย่ ซากุระ พิงคิช 7มล ,6,Y 
11252,46170,102685955,1,Y ,8994993027873,WBPการ์นิเย่ ไลท์ เดย์ 7มล.P6 ,8994993027866,0,การ์นิเย่ ไลท์ เดย์ 7 มล ,6,Y 
