Site,Structure,Root Code,SV,Saleable,Barcode,Description,Barcode Component,SV,Description Component,Quantity,Saleable
11252,41020,100556172,1,Y ,48850188170206,WBPนกเหยี่ยวนมข้นจืด 360มล P48 ,8850188170208,0,นกเหยี่ยวนมข้นจืด 360 มล. ,48,Y 
11252,41020,100579188,1,Y ,18850151061110,WBPมะลิ นมข้นหวาน 355 กรัม P48 ,8850151961116,0,มะลินมข้นหวาน กป 355 กรัม ,48,Y 
11252,41020,100579189,1,Y ,18850151065118,WBPเบิดวิงซ์ครีมข้นหวาน370GP48 ,8850151965114,0,เบิรดวิงครีมเทียมข้นหวานกป370ก ,48,Y 
11252,41020,100613815,2,Y ,8850128000114,WBPเนสกาแฟเรดคัพคั่วบด40ก P24 ,8850128030111,0,เนสกาแฟเรดคัพ MRC-ARC ดอย 40ก ,24,Y 
11252,41020,100613815,1,N ,8850128000121,WBPเนสกาแฟเรดคัพคั่วบด 45ก P96 ,8850128030111,0,เนสกาแฟเรดคัพ MRC-ARC ดอย 40ก ,96,Y 
11252,41020,100613857,1,Y ,98850128030282,WBPเนสกาแฟเรดคัพ 360 กรัม P18 ,8850128030074,0,เนสกาแฟเรดคัพ360ก กล่อง ,18,N 
11252,41020,100613867,1,Y ,78851012011314,WBPคาร์เนชันครีมข้นหวาน388กP48 ,8851012011315,0,คาเนชันครีมเทียมข้นหวาน กป388ก ,48,Y 
11252,41020,100665041,1,Y ,48850188140209,WBPนกเหยี่ยวครีมข้นหวาน370กP48 ,8850188140201,0,นกเหยี่ยวครีมเทียขนหวาน กป370ก ,48,Y 
11252,41020,100705404,1,N ,8850127004434,WBPเนสกาแฟ เอสเปรสโซ P27X24ถุง ,8850127004410,0,เนสกาแฟ3อิน1 เอสเปรสโซ15.1กX27 ,24,Y 
11252,41020,100730949,1,Y ,8850124018212,WBPคาร์เนชั่น นมจืด 405ก P48 ,8850124018205,0,คาร์เนชั่นนมข้นจืด กป 405ก ,48,Y 
11252,41020,100740825,1,Y ,8850124002945,WBPเนสกาแฟเรดคัพ 2ก 48ซอง P20 ,8850124002938,0,เนสกาแฟเรดคัพ MRC-ARC 2กX48 ,20,Y 
11252,41020,100813628,1,Y ,18850151053115,WBPออร์คิดครีมเทียมหวาน380GP48 ,8850151953111,0,ออร์คิดครีมเทียมข้นหวาน กป370ก ,48,N 
11252,41020,100827335,2,N ,8850127004403,WBPเนสกาแฟบรูริชอโรมาP27X24ถุง ,8850127004397,0,เนสกาแฟ3อิน1 ริชอโรมา 16กX27 ,24,Y 
11252,41020,100918972,2,Y ,8850124071002,WBPคาร์เนชันครีมเอกตร้า385กP48 ,8850124070999,0,คาเนชันEXTRAครีมพรองไขมันกป385 ,48,Y 
11252,41020,100918972,1,Y ,8850124071002,WBPคาร์เนชันครีมเอกตร้า385กP48 ,8850124070999,0,คาเนชันEXTRAครีมพรองไขมันกป385 ,48,Y 
11252,41020,100975816,1,N ,8850762060062,WBPพาเลซครีมเทียมขนหวาน380กP48 ,8850762050230,0,พาเลซครีมเทยมข้นหวาพรองไขกป380 ,48,N 
11252,41020,101027799,1,Y ,18850151981128,ครีมเทียมพร่องมะลิ ก385กX48 ,8850151981121,0,มะลิโกลครีมเทียมพร่อง กป 385ก ,48,Y 
11252,41020,101051914,1,Y ,48858705601172,WBPทีพอทครีมเทียมขนหวาน380กP48 ,8858705601167,0,ทีพอทครีมเทียมพรองมนเนย กป380ก ,48,Y 
11252,41020,101051917,1,Y ,48858705601684,WBPทีพอทครีมเทียมเอกตรา385กP48 ,8858705601679,0,ทีพอทEXTRAครีมเทยมพรองไขกป385ก ,48,Y 
11252,41020,101312523,1,N ,18850151951022,WBPมะลิโกลดครีมเทียมข้น380กP48 ,8850151951018,0,มะลิครีมเทียมข้นหวานโกล กป380ก ,48,Y 
11252,41020,101458031,1,Y ,8850389300213,P_PACKเพรียวคลอโรฟิลผง4.25ก*48 ,8850389300183,0,P_เพรียว คลอโรฟิลล์ชนิดผง 4.25 กรัม ,48,Y 
11252,41020,102163332,1,Y ,8850124037480,WBPคาร์เนชั่นครีมเทียมข้น2กกP8 ,8850124037473,0,WBPคาร์เนชัน ครีมข้นหวานถุง2กก ,8,Y 
11252,41020,102169146,1,Y ,8852099213135,BIGCกาแฟสำเร็จรูป200ก.ขวดP12 ,8852099213128,0,BIGCกาแฟสำเร็จรูป200ก.(ขวด) ,12,N 
11252,41020,102169149,1,Y ,8852099215238,BIGCกาแฟสำเร็จรูป380G.P12 ,8852099215221,0,BIGCกาแฟสำเร็จรูป380G. ,12,N 
11252,41020,102172669,1,Y ,8852114909838,BIGCครีมเทียม 900G.กล่องP12 ,8852114902808,0,BIGCครีมเทียม 900G.กล่อง ,12,N 
11252,41020,102172671,1,Y ,8852114909234,BIGCครีมเทียม200ก.ซองตั้งP60 ,8852114901276,0,BIGCครีมเทียม200 กรัม ซองตั้ง ,60,N 
11252,41020,102172711,1,N ,8850762050193,BIGC ครีมเทียมข้นหวาน380G P48 ,8850762060055,0,BIGC ครีมเทียมข้นหวานพร่องมันเนย380G ,48,N 
11252,41020,102233706,1,Y ,8850370771527,ชาตรามือชาไทย 3IN1 100กรัมX4 ,8850370771459,0,ชาตรามือชาไทย 3IN1 20กรัมX5ซอง ,4,Y 
11252,41020,102330608,1,N ,8850125073357,BPเนสกาแฟเรดคัพเอส330ก*18แพค ,8850125072800,0,เนสกาแฟเอสเปรสโซ่330ก กล่อง ,18,N 
11252,41020,102494180,1,Y ,8850151951384,มะลิข้นหวานหลอดบีบ 170 ก แพค12 ,8850151951377,0,มะลินมข้นหวานหลอดบีบ 170 ก ,12,Y 
11252,41020,102532136,1,Y ,8858705609286,ทีพอทนมข้นหวานนมสดหลอดบีบ180ก ,8858705607572,0,ทีพอทข้นหวานนมสดหลอดบีบ180กรัม ,8,Y 
11252,41020,102532137,1,Y ,8858705609309,ทีพอทนมข้นช็อกหลอด180*8 ,8858705607541,0,ทีพอทข้นหวานชอคโกแลหลอดบีบ180G ,8,Y 
11252,41020,102894097,1,Y ,8858705601235,WBPทีพอท ครีมเทียมข้นหวาน2กกP8 ,8858705601228,0,WBPทีพอท ครีมเทียมข้นหวาน 2กก. ,8,Y 
11252,41020,102911565,1,N ,18850151951206,BPมะลินมข้นหวาน2กก.P10 ,8850151951209,0,WBPมะลิ ผลิตภัณฑ์นมข้นหวาน 2กก ,10,Y 
11252,41020,103067599,1,N ,8850124037923,WBPคาร์เนชันครีมข้นหวาน505GP48 ,8850124037916,0,คารเนชันครีมเทียมข้นหวาน กป505 ,48,Y 
11252,41020,103108878,1,Y ,18850188801680,WBPนกเหยี่ยว นมข้นหวาน 2กก P8 ,8850188801683,0,WBPนกเหยียวครีมเทียมข้นหวาน2กก ,8,Y 
11252,41030,101019843,1,Y ,8851123225021,เปปทีน4000  100 มล. 1X4X6 ,8851123225014,0,เปปทีน4000 (100 มล.*6) ,4,Y 
11252,41030,102681329,1,Y ,28851123225407,เปปทีน พลัส 100 ML. 1X4X6 ,8851123225397,0,เปปทีนพลัส100 มล.แพค6 ขวด ,4,Y 
11252,41040,102159889,1,Y ,8852805006075,BIGCแป้งทอดกรอบ150G P36 ,8852805006051,0,BIGCแป้งทอดกรอบ150G ,36,N 
11252,41040,102159930,1,Y ,8852805006037,BIGCแป้งทอดรสกระเทียม90G.P24 ,8852805006068,0,BIGCแป้งทอดกรอบรสกระเทียม90G. ,24,N 
11252,41040,102159941,1,Y ,8852805006020,BIGCแป้งชุบทอดรสเผ็ดร้อน90กP24 ,8852805006044,0,BIGCแป้งชุบทอดรสเผ็ดร้อน 90 G. ,24,N 
11252,41040,102172808,1,Y ,8858769704019,BIGCแยมสตรอเบอร์รี200G.P18 ,8858769701605,0,BIGCแยมสตรอเบอร์รี200G. ,18,N 
11252,41040,102172810,1,Y ,8858769704033,BIGCแยมมิกซ์เบอร์รี200G.P18 ,8858769702114,0,BIGCแยมมิกซ์เบอร์รี200G. ,18,N 
11252,41040,102172811,1,Y ,8858769704040,BIGCแยมสตรอเบอร์รี400G.P12 ,8858769702107,0,BIGCแยมสตรอเบอร์รี400G. ,12,N 
11252,41040,102172812,1,Y ,8858769704057,BIGCมาร์มาเลดส้ม400G.P12 ,8858769701636,0,BIGCมาร์มาเลดส้ม400G. ,12,N 
11252,41040,102189507,1,Y ,88850297992100,BIGCเกล็ดขนมปังชุบทอด1000G.P10 ,8850297992111,0,BIGCเกล็ดขนมปังชุบทอด1000G. ,10,N 
11252,41040,102304047,1,Y ,28850341100329,BIGCแป้งข้าวเจ้า400G.P24 ,8850341101179,0,BIGCแป้งข้าวเจ้า400G. ,24,N 
11252,41040,102532126,1,Y ,28850341700123,BIGC แป้งข้าวโพด 400 กรัมP24 ,8850341700129,0,BIGC แป้งข้าวโพด 400 กรัม ,24,N 
11252,41040,102823031,1,Y ,8858769704071,แยมน้ำตาลน้อยสตอเบอรี่125ก P24 ,8858769701483,0,EXCแยมน้ำตาลน้อย สตอเบอรี่125ก ,24,N 
11252,41040,102823032,1,Y ,8858769704088,แยมน้ำตาลน้อย ส้ม 125ก.P24 ,8858769701490,0,EXC แยมน้ำตาลน้อย ส้ม 125ก. ,24,N 
11252,41040,102823033,1,Y ,8858769704095,แยมน้ำตาลน้อย บลู&สตอเบอรี่P24 ,8858769701506,0,EXCแยมน้ำตาลน้อย บลู&สตอเบอรี่ ,24,N 
11252,41040,103026751,1,Y ,18850332192343,อิมพีเรียลแป้งแพนเค้ก800ก.P10 ,8850332192346,0,อิมพีเรียลแป้งแพนเค้กมิกซ์800ก ,10,N 
11252,41040,103178356,1,Y ,8854599006613,BP_HPPน้ำผึ้งดอกลำไย130กรัมP6 ,8854599006590,0,HPPน้ำผึ้งดอกลำไย 130กรัม ,6,Y 
11252,41050,100669030,1,Y ,8853333001341,BPลำไยมาลี6OZ.P6(M) ,8853333000535,0,มาลีลำใย6ออนซ์ ,6,Y 
11252,41050,102172710,1,Y ,8850134905076,BIGCเงาะในน้ำเชื่อม565กรัม P24 ,8850134106176,0,BIGC เงาะในน้ำเชื่อม565กรัม ,24,N 
11252,41050,102210634,1,Y ,18859505011047,BIGCลำไยในน้ำเชื่อม565กรัม P24 ,8859505011040,0,BIGC ลำไยในน้ำเชื่อม565กรัม ,24,N 
11252,41050,102297619,1,N ,18859505010040,BIGCลิ้นจี่ในน้ำเชื่อม565ก P24 ,8859505010043,0,BIGCลิ้นจี่ในน้ำเชื่อม565กรัม ,24,N 
11252,41060,100521708,1,N ,18851359702041,BP ดูแลค 575ก.P12 ,8851359700835,0,ดูเม็กซ์ ดูแลค 550ก ,12,Y 
11252,41060,100521709,1,N ,18851359702010,BPดูโปรDHA&ARA550G.P12 ,8851359700842,0,ดูเม็กซ์ ดูโปร 550ก ,12,Y 
11252,41060,100646977,1,N ,18851359702171,ไฮคิว พรีไบโอสูตร3จืด 550กP12 ,8851359700729,0,ไฮคิวพรีไบโอโพรเทก3 550 ,12,Y 
11252,41060,100710219,1,N ,18851359700856,BPดูมิลค์ 1พลัส จืด 550กP12 ,8851359700859,0,ดูมิลค์ 1พลัส จืด 550ก ,12,Y 
11252,41060,100752283,1,N ,18851005060068,BP S-26นมทารกเอสเอ็มเอ600กP12 ,8851005070060,0,S26 โปรเกรส 3 500กรัม ,12,Y 
11252,41060,100779377,1,N ,18851359705004,BPไฮคิว1-600ก. กระป๋องP12 ,8851359705007,0,ไฮคิวพรีไบโอโพรเทก1 550 ,12,Y 
11252,41060,100779398,1,N ,18851359705028,BPไฮคิว2-600ก.กระป๋องP12 ,8851359705021,0,ไฮคิวพรีไบโอโพรเทก2 550 ,12,Y 
11252,41060,100781633,1,N ,28851359701713,BPดูเม็กซ์ ดูแลค 250ก.P12 ,8851359910111,0,ดูเม็กซ์ ดูแลค 250ก ,12,Y 
11252,41060,100781646,1,N ,28851359701737,BP ดูเม็กซ์ ดูโปร 250ก.P12 ,8851359950117,0,ดูเม็กซ์ ดูโปร 250ก ,12,Y 
11252,41060,100803302,1,N ,18851005020147,BP S-26นมทารกเอสเอ็มเอ600กP12 ,8851005020140,0,S26 เอสเอ็มเอ1 500กรัม ,12,Y 
11252,41060,100803306,1,N ,18851005050038,BP S-26โปรมิลนมเด็กเล็ก350กP12 ,8851005050031,0,S26 โปรมิล 2 200กรัม ,12,N 
11252,41060,100803307,1,N ,18851005050069,BP S-26โปรมิลนมเด็กเล็ก600กP12 ,8851005050062,0,S26 โปรมิล 2 500กรัม ,12,Y 
11252,41060,100803323,1,N ,18851005330062,BPเอส-26 โกลด์ โปรมิล 600กP12 ,8851005330065,0,S26 โกลด์ โปรมิล 2 500กรัม ,12,Y 
11252,41060,100803332,1,N ,18851005320148,BPเอส-26 โกลด์เอสเอ็มเอ600กP12 ,8851005320141,0,S26 โกลด์ เอสเอ็มเอ1 500กรัม ,12,Y 
11252,41060,100827379,1,N ,18851005030061,BPเอส26โกลด์โปรเกรส600กP12 ,8851005030064,0,S26 โกลด์ โปรเกรส 3 500กรัม ,12,Y 
11252,41060,100834367,1,N ,18851359702836,BP ดูเม็กซ์ดูโกรสูตร3จืด550P12 ,8851359702839,0,ดูเม็กซ์ ดูโกร 550ก ,12,Y 
11252,41060,101062207,1,N ,18851359700160,BPดูมิลค์ 1พลัส น้ำผึ้ง550กP12 ,8851359700439,0,ดูมิลค์ 1พลัส น้ำผึ้ง 550ก ,12,N 
11252,41060,101379963,1,N ,18851359705943,BPดูมิลค์ 1พลัส จืด 900กP12 ,8851359705946,0,ดูมิลค์ 1พลัส จืด 850ก ,12,Y 
11252,41060,102010601,1,N ,18851359705851,BPไฮคิว2ซุปเปอร์โกลจืด 600กP12 ,8851359705854,0,ไฮคิวซูเปอร์โกลด์2 570G ,12,Y 
11252,41060,102124068,1,N ,18851359706124,BPดูเม็กซ์ไฮคิวซูเปอร์โกลด์600 ,8851359707124,0,ไฮคิวซูเปอร์โกลด์1 570 ,12,Y 
11252,41060,103186028,1,Y ,8934804051369,เอส-26 โกลด์ เอสเอ็มเอ180มลX24 ,8934804044347,0,เอส-26 โกลด์ เอสเอ็มเอ180มลX3 ,8,Y 
11252,41060,103186029,1,Y ,8934804051376,เอส-26 โกลด์ โปรมิล 180มลX24 ,8934804044316,0,เอส-26 โกลด์ โปรมิล 180มลX3 ,8,Y 
11252,42010,100572290,1,Y ,8852052310505,WBPฮานามิข้าวเกรียบกุ้ง 52ก P4 ,8852052110501,0,ข้าวเกรียบกุ้งฮานามิ52Gดังเดิม ,4,Y 
11252,42010,100614981,1,Y ,8851004101703,WBPปาร์ตี้คาราเมล 24ก P6 ,8851004101116,0,ปาร์ตี้คาราเมล 24 กรัม ,6,Y 
11252,42010,100614994,2,N ,2001031790357,WBPโรลเลอร์ต้นตำหรับ54ก P3 ,8850309003231,0,โรลเลอร์ต้นตำหรับ54ก. ,3,Y 
11252,42010,100614994,1,N ,48850309003239,WBPโรลเลอร์ 54ก P12 ,8850309003231,0,โรลเลอร์ต้นตำหรับ54ก. ,12,Y 
11252,42010,100614995,2,N ,48850309003338,WBPโรลเลอร์หัวหอม 54ก P12 ,8850309003330,0,โรลเลอร์หอมทรงเครือง54ก. ,12,Y 
11252,42010,100615377,1,Y ,8850284010422,WBPเมล็ดฟักทองตรามือ28ก.P6 ,8850284010415,0,เมล็ดฟักทองมือ28G(M) ,6,Y 
11252,42010,100615504,1,Y ,98851727002021,WBPปาปริก้ามันฝรั่ง16ก P72 ,8851727902021,0,WBPปาปริก้ามันฝรั่ง 12ก.P12 ,6,Y 
11252,42010,100615505,1,Y ,98851727003011,WBPคอนเน่ข้าวโพดอบกรอบ 14ก P72 ,8851727903011,0,WBPคอนเน่ดั้งเดิม 11ก.P12 ,6,Y 
11252,42010,100626499,1,Y ,8852020219991,WBPอาริงาโตรสดั้งเดิม50ก.P3 ,8852020211124,0,อาริงาโตเกรียบหมึกดั้งเดิม 50ก ,3,Y 
11252,42010,100694289,1,Y ,8851004801061,WBPโดโซะข้าวอบกลมกล่อม 56ก P6 ,8851004801184,0,โดโซะข้าวอบกรอบรสกลมกล่อม 56G(MP) ,6,Y 
11252,42010,100798582,2,N ,8850718902118,WBPตะวันกุ้งกรอบ 67กX16 ลัง ,8850718802111,0,ตะวันรสกุ้งกรอบ56-67กรัม ,16,Y 
11252,42010,100798582,1,Y ,8850718707287,WBPตะวันกุ้งกรอบ67กP3 ,8850718802111,0,ตะวันรสกุ้งกรอบ56-67กรัม ,3,Y 
11252,42010,101058919,1,N ,8852023004266,WBPโก๋แก่ลันเตาวาซาบิ 32ก P6 ,8852023004228,0,โก๋แก่ถั่วลันเตาวาซาบิ 30ก. ,6,Y 
11252,42010,101063627,1,Y ,8850718707294,WBPตะวันรสหมึกสามรส67กP3 ,8850718804764,0,ตะวันรสหมึกสามรส56-67กรัม ,3,Y 
11252,42010,101063627,2,N ,8850718904761,WBPตะวันหมึกสามรส 67กX16 ลัง ,8850718804764,0,ตะวันรสหมึกสามรส56-67กรัม ,16,Y 
11252,42010,101111062,1,N ,18852049000133,WBPจังโก้เมล็ดทานตะวัน 90กP6 ,8852049000136,0,จังโก้เมล็ดทานตะวันสมุนไพร80ก ,6,Y 
11252,42010,101137843,1,N ,2001028025790,BPปูไทยรสปลาหมึก60ก.P3 ,8850765105098,0,ปูไทยรสปลาหมึก 55 กรัม ,3,Y 
11252,42010,102006987,1,N ,2001028025783,BPปูไทยรสโนริสาหร่าย60ก.P3 ,8850765305092,0,ปูไทยรสโนริสาหร่าย 55 กรัม ,3,Y 
11252,42010,102058592,1,N ,8852023006130,WBPโก๋แก่ถั่วเยือแดงเกลือ40กP6 ,8852023006123,0,โก๋แก่ถั่วลิสงเยื่อแดงเกลือ40ก ,6,Y 
11252,42010,102058636,1,Y ,8859559600382,WBPชาช่าทานตะวัน5รส 45ก P12 ,8859559600375,0,ชาช่าเมล็ดทานตะวัน5รส45กรัม ,12,Y 
11252,42010,102058637,1,Y ,8859559600412,WBPชาช่าทานตะวันมะพร้าว45ก P12 ,8859559600405,0,ชาช่าเมล็ดทานตะวันรสมะพร้าว45กรัม ,12,Y 
11252,42010,102100875,1,Y ,98851727002052,WBPปาปริก้ามันฝรั่ง 65ก P18 ,8851727902052,0,WBPปาปริก้ามันฝรั่ง 56ก P3 ,6,Y 
11252,42010,102125832,1,Y ,8852023006581,BPโก๋แก่พลัสถั่วรวมไทยสไป28ก*6 ,8852023006574,0,โก๋แก่พลัสถั่วรวมไทยสไปซี่28ก. ,6,Y 
11252,42010,102155599,1,Y ,8850718707713,WBPตะวันสาหร่าย67กP3 ,8850718807963,0,ตะวันรสสาหร่ายทรงเครื่อง56-67ก ,3,Y 
11252,42010,102155599,2,N ,8850718908516,WBPตะวันรสสาหร่าย 67กX16 ลัง ,8850718807963,0,ตะวันรสสาหร่ายทรงเครื่อง56-67ก ,16,Y 
11252,42010,102231977,1,Y ,8852023007458,BPโก๋แก่ปากอ้าคาดเชือกวาบิ40*6 ,8852023007434,0,โก๋แก่ปากอ้าคาดเชือกวาซาบิ 40ก ,6,N 
11252,42010,102327122,1,N ,8852023008349,WBPโก๋แก่ลันเตาโรยเกลือ 42ก P6 ,8852023008257,0,โก๋แก่ถั่วลันเตาโรยเกลือ42ก. ,6,Y 
11252,42010,102356559,1,Y ,8851004101031,WBPปาร์ตี้คาราเมล 48ก P3 ,8851004101208,0,ปาร์ตี้คาราเมล 48 กรัม ,3,Y 
11252,42010,102480135,1,Y ,8851004101048,WBPปาร์ตี้ครองแครง 48ก P3 ,8851004101215,0,ปาร์ตี้ครองแครง 48 กรัม ,3,Y 
11252,42010,102485669,1,Y ,8852023009872,BPโก๋แก่แม็กซ์วาซาบิญีปุน35ก*6 ,8852023009810,0,โก๋แก่แม็กซ์วาซาบิ 35ก. ,6,N 
11252,42010,102492607,1,N ,8851234310524,WBPกรีนนัทลันเตาออริจิ70กP3 ,8851234310166,0,กรีนนัทถั่วลันเตากรอบมาตรฐาน70 ,3,Y 
11252,42010,102492608,1,N ,8851234310531,WBPกรีนนัทลันเตาปลาหมึก70กP3 ,8851234310173,0,กรีนนัทถั่วลันเตากรอบหมึก70ก ,3,Y 
11252,42010,102492609,1,N ,8851234310548,WBPกรีนนัทลันเตากุ้ง70กP3 ,8851234310180,0,กรีนนัทถั่วลันเตากรอบกุ้ง70ก ,3,Y 
11252,42010,102501326,1,Y ,8851234310067,WBPกรีนนัทลันเตาซอสพริก82กP3 ,8851234310586,0,กรีนนัทถั่วลันเตากรอบซอสพริก70 ,3,Y 
11252,42010,102507729,2,N ,8850718913398,WBPตะวันรสลาบแซ่บ 67กX16 ลัง ,8850718811137,0,ตะวันรสลาบแซ่บ56-67กรัม ,16,Y 
11252,42010,102507729,1,Y ,8850718709861,WBPตะวันลาบแซ่บ67กP3 ,8850718811137,0,ตะวันรสลาบแซ่บ56-67กรัม ,3,Y 
11252,42010,102651285,1,Y ,8850718710942,WBPตะวันต้นตำรับ 67ก P3 ,8850718812790,0,ตะวันรสต้นตำรับ 67 กรัม ,3,Y 
11252,42010,102651285,2,N ,8850718915286,WBPตะวันต้นตำรับ 67กX16 ลัง ,8850718812790,0,ตะวันรสต้นตำรับ 67 กรัม ,16,Y 
11252,42010,102811982,1,Y ,4800092660641,IMP_ช็อกโกมูโช มิลชอก25กP10 ,4800092660634,0,IMP_ช็อกโกมูโช มิลชอก25ก ,10,Y 
11252,42010,102815400,1,Y ,8854923311314,WBPสแน็คแจ๊คกุ้งพริกเกลือ62กP4 ,8854923311307,0,สแน็คแจ๊คกุ้งคั่วพริกเกลือ 62ก ,4,Y 
11252,42010,102815405,1,Y ,48850309216028,WBPโรลเลอร์ทิน สไปซี่ชีส54กP12 ,8850309216013,0,โรลเลอร์ทินสไปซี่ดับเบิลชีส54ก ,12,Y 
11252,42010,102815406,1,Y ,48850309216066,WBPโรลเลอร์ทินชิลลี่ฮอต54กP12 ,8850309216051,0,โรลเลอร์ทินชิลลีฮอตบอมบ์  54ก ,12,Y 
11252,42010,102822845,1,Y ,28857125291013,WBPไก๋ไก่หนังไก่ดั้งเดิม32กP36 ,8857125291019,0,EXC_ไก่ไก๋ หนังไก่ ดั้งเดิม32ก ,36,N 
11252,42010,102822846,1,Y ,28857125291020,WBPไก๋ไก่ หนังไก่กรอบBBQ32กP36 ,8857125291026,0,EXC_ไก่ไก๋ หนังไก่บาร์บีคิว32ก ,36,N 
11252,42010,102822847,1,Y ,28857125291167,WBPไก๋ไก่หนังไก่ศรีราช32กP36 ,8857125291163,0,EXC_ไก่ไก๋ หนังไก่ศรีราชา32ก ,36,N 
11252,42010,102884142,1,Y ,8854923314315,WBPสแน็คแจ๊คหอยเชลล์สไปซี62กP4 ,8854923314308,0,สแน็คแจ๊คหอยเชลล์สไปซี่ 62ก ,4,Y 
11252,42010,102911948,1,N ,6924187885417,BPชาช่าทานตะวันพุทธา40ก.P12 ,6924187885400,0,ชาช่า ทานตะวันพุทราจีน40ก ,12,N 
11252,42010,102911949,1,N ,6924187885424,WBPชาช่าทานตะวันกาแฟ 40ก P12 ,6924187885394,0,ชาช่า ทานตะวัน รสกาแฟ40ก ,12,N 
11252,42010,102946017,1,N ,8851004199861,BPปาร์ตี้ปังเย็นนมชมพู 57กP3 ,8851004199878,0,ปาร์ตี้ปังเย็นนมชมพู 57 กรัม ,3,N 
11252,42010,102946018,1,N ,8851004199823,BPปาร์ตี้เลมอนชีสเค้ก 57กP3 ,8851004199830,0,ปาร์ตี้เลมอนชีสเค้ก 57 กรัม ,3,N 
11252,42010,103003594,1,Y ,48850309218688,WBPโรลเลอร์เอ็กซตร้าBBQ54กP12 ,8850309219922,0,โรลเลอร์เอ็กซ์ตร้าบาร์บีคิว54ก ,12,Y 
